{
  "state": "running",
  "sessionId": "0192a7c0-0000-7000-8000-000000000a01",
  "blockId": "0192a7c0-0000-7000-8000-000000000c01",
  "pluginVersion": "1.0.0",
  "engineVersion": "3.2.0",
  "profileLocation": {
    "latDeg": 31.5471,
    "lonDeg": -99.3823
  },
  "cameraReadoutModes": [
    {
      "index": 0,
      "name": "High Gain Mode"
    },
    {
      "index": 1,
      "name": "Low Noise Mode"
    }
  ],
  "meridianFlip": {
    "triggerPresent": true,
    "useSideOfPier": true,
    "recenter": false,
    "autoFocusAfterFlip": false,
    "settleTimeS": 30,
    "pauseBeforeMin": 0,
    "afterMin": 5,
    "maxAfterMin": 15
  },
  "rotator": {
    "connected": true,
    "rangeType": "FULL",
    "rangeStartMechanicalDeg": 0,
    "reverse": false
  },
  "plateSolve": {
    "rotationToleranceDeg": 1.0
  },
  "mount": {
    "equatorialSystem": "JNOW",
    "siteLatDeg": 31.5471,
    "siteLonDeg": -99.3823,
    "siderealTimeDeltaS": 0.4
  },
  "sequenceTriggers": {
    "autofocus": [
      "AutofocusAfterTimeTrigger",
      "AutofocusAfterHFRIncreaseTrigger"
    ],
    "autofocusAfterTimeMin": 60,
    "dither": []
  },
  "camera": {
    "temperatureC": -10.1,
    "setPointC": -10.0,
    "coolerOn": true,
    "coolerPowerPct": 38
  },
  "lastMeasuredRotationDeg": 0.3,
  "filterWheel": [
    {
      "position": 1,
      "name": "L",
      "focusOffset": 0
    },
    {
      "position": 2,
      "name": "Ha 3nm",
      "focusOffset": 35
    },
    {
      "position": 3,
      "name": "Red",
      "focusOffset": 12
    }
  ],
  "outboxPending": 0,
  "deadLetters": 0,
  "settingsVersion": 12,
  "offlineUntil": null,
  "ackedCommandIds": [
    "0192d0…"
  ]
}